{
  "schema": "bears-validation-state.v1",
  "version": "1",
  "status": "pass",
  "updated_at": "2026-06-24T00:00:00Z",
  "repo_path": "/srv/bears/plugins/bears",
  "repo_id": "plugins_bears",
  "commit_sha": "1111111111111111111111111111111111111111",
  "job_id": "plugins_bears-111111111111",
  "job_path": "runtime/validation-jobs/1111111111111111111111111111111111111111/plugins_bears-111111111111.json",
  "changed_files": [
    "scripts/validation_queue.py"
  ],
  "selected_tests": [
    "tests/test_async_validation.py"
  ],
  "validators": [
    "scripts/test_selection.py run --tier fast"
  ],
  "shard_id": "main",
  "timeout_seconds": 600,
  "exit_code": 0,
  "failure_classification": "none",
  "retry_count": 0,
  "sanitized_summary": "validation passed",
  "remediation_packet": null,
  "local_commit_validation_proof": "runtime/local-commit-validation/1111111111111111111111111111111111111111.json"
}
